<?xml version="1.0" encoding="utf-8"?>
<XnaContent xmlns:ns="Microsoft.Xna.Framework"
            xmlns:xsi="http://www.w3.org/2001/XMLSchema-instance"
            xmlns="http://www.amodifier.com/XnaContent"
            xsi:schemaLocation="http://www.amodifier.com/XnaContent Content/File.xsd">
    <Asset Type="System.Collections.Generic.List[System.Collections.Generic.List[string]]">
        <!--Level 1 -->
        <Item>
            <Item>#,#,#,#,#,#,#,#,#,#,#,#,#,#,#,#,#,#,#,#</Item>
            <Item>#, , , ,#,#,#,#,#,#,#,#,#,#,#,#,#,#,#,#</Item>
            <Item>#, ,P, , , , , ,#,#,#, , ,.,., , ,#,#,#</Item>
            <Item>#,#,#,#, ,#, ,#,#, ,#, ,B, , ,#, ,#,#,#</Item>
            <Item>#,#, ,#, ,#, , , , , ,#, ,#, ,#, ,#,#,#</Item>
            <Item>#,#, , , , , ,#,#,#, , , ,#,B, , , ,#,#</Item>
            <Item>#,#,#,#,#,#,#, , , , , , ,#, , , ,#,#,#</Item>
            <Item>#,#,#,#,#,#,#,#,#,#,#,#,#,#,#,#,#,#,#,#</Item>
            <Item>#,#,#,#,#,#,#,#,#,#,#,#,#,#,#,#,#,#,#,#</Item>
            <Item>#,#,#,#,#,#,#,#,#,#,#,#,#,#,#,#,#,#,#,#</Item>
        </Item>
         <!-- Level 2 -->
        <Item>
            <Item>#,#,#,#,#,#,#,#,#,#,#,#,#,#,#,#,#,#,#,#</Item>
            <Item> , , ,#,#,#,#,#,#,#, , ,#,#,#,#,#,#,#,#</Item>
            <Item> , ,#,#, , ,#, , ,#,#, ,#,#,#,#,#,#,#,#</Item>
            <Item> ,#,#,.,.,., ,.,.,.,#,#,#,#,#,#,#,#,#,#</Item>
            <Item>#,#, ,B,#,B,#,B,B,B, ,#,#,#,#,#,#,#,#,#</Item>
            <Item>#, , ,P, , ,#, , , , ,#,#,#,#,#,#,#,#,#</Item>
            <Item>#, ,#, , ,#,#,#, ,#, ,#,#,#,#,#,#,#,#,#</Item>
            <Item>#, , , , ,#, ,#, , , ,#,#,#,#,#,#,#,#,#</Item>
            <Item>#,#,#,#,#,#, ,#,#,#,#,#,#,#,#,#,#,#,#,#</Item>
            <Item>#,#,#,#,#,#,#,#,#,#,#,#,#,#,#,#,#,#,#,#</Item>
        </Item>
      <!--Level 3-->
        <Item>
            <Item>#,#,#,#,#,#,#,#,#,#,#,#,#,#,#,#,#,#,#,#</Item>
            <Item>#,#,#,#, , , ,#,#,#,#,#,#,#,#,#,#,#,#,#</Item>
            <Item>#,#,.,P,B, , ,#,#,#,#,#,#,#,#,#,#,#,#,#</Item>
            <Item>#,#,#,#, ,B,.,#,#,#,#,#,#,#,#,#,#,#,#,#</Item>
            <Item>#,#,.,#,#,B, ,#,#,#,#,#,#,#,#,#,#,#,#,#</Item>
            <Item>#,#, ,#, ,., ,#,#,#,#,#,#,#,#,#,#,#,#,#</Item>
            <Item>#,#,B, ,.B,B,B,.,#,#,#,#,#,#,#,#,#,#,#,#</Item>
            <Item>#,#, , , ,., , ,#,#,#,#,#,#,#,#,#,#,#,#</Item>
            <Item>#,#,#,#,#,#,#,#,#,#,#,#,#,#,#,#,#,#,#,#</Item>
            <Item>#,#,#,#,#,#,#,#,#,#,#,#,#,#,#,#,#,#,#,#</Item>
        </Item>
        <!--Level 4-->
        <Item>
            <Item>#,#,#,#,#,#,#,#, , ,#,#,#,#,#,#,#,#,#,#</Item>
            <Item>#, , , , , , ,#, , ,#,#,#,#,#,#,#,#,#,#</Item>
            <Item>#, ,#,#,#,#, ,#, , ,#,#,#,#,#,#,#,#,#,#</Item>
            <Item>#, ,#, , ,#, ,#, , ,#,#,#,#,#,#,#,#,#,#</Item>
            <Item>#, ,#, , ,#, ,#,#,#,#,#,#,#,#,#,#,#,#,#</Item>
            <Item>#, , ,.,.,.,.,., ,#,#,#,#,#,#,#,#,#,#,#</Item>
            <Item>#,#, ,B,B,B,B,B, ,#,#,#,#,#,#,#,#,#,#,#</Item>
            <Item> ,#,#,#,P,#, ,#,#,#,#,#,#,#,#,#,#,#,#,#</Item>
            <Item> , , ,#, , , ,#, , ,#,#,#,#,#,#,#,#,#,#</Item>
            <Item> , , ,#,#,#,#,#, , ,#,#,#,#,#,#,#,#,#,#</Item>
        </Item>
        <!-- Level 5 -->
        <Item>
            <Item>#,#,#,#,#,#,#,#,#,#,#,#, , ,#,#,#,#,#,#</Item>
            <Item>#,.,., , ,#, , , , , ,#,#,#,#,#,#,#,#,#</Item>
            <Item>#,.,., , ,#, ,B, , ,B, , ,#,#,#,#,#,#,#</Item>
            <Item>#,.,., , ,#,B,#,#,#,#, , ,#,#,#,#,#,#,#</Item>
            <Item>#,.,., , , , ,P, ,#,#, , ,#,#,#,#,#,#,#</Item>
            <Item>#,.,., , ,#, ,#, , ,B, ,#,#,#,#,#,#,#,#</Item>
            <Item>#,#,#,#,#,#, ,#,#,B, , , ,#,#,#,#,#,#,#</Item>
            <Item> , ,#, ,B, , ,B, ,B, , , ,#,#,#,#,#,#,#</Item>
            <Item> , ,#, , , , ,#, , , , , ,#,#,#,#,#,#,#</Item>
            <Item> , ,#,#,#,#,#,#,#,#,#,#,#,#,#,#,#,#,#,#</Item>
        </Item>
        <!-- Level 6 -->
        <Item>
            <Item> , , , , , , , ,#,#,#,#,#,#,#,#, ,#,#,#</Item>
            <Item> , , , , , , , ,#, , , , , ,P,#, ,#,#,#</Item>
            <Item> , , , , , , , ,#, ,B,#,B, ,#,#, ,#,#,#</Item>
            <Item> , , , , , , , ,#, ,B, , ,B,#, , ,#,#,#</Item>
            <Item> , , , , , , , ,#,#,B, ,B, ,#, , ,#,#,#</Item>
            <Item>#,#,#,#,#,#,#,#,#, ,B, ,#, ,#,#,#,#,#,#</Item>
            <Item>#,.,.,., , ,#,#,#, ,B, , ,B, , ,#,#,#,#</Item>
            <Item>#,#,.,., , , , , ,B, , ,B, , , ,#,#,#,#</Item>
            <Item>#,.,.,., , ,#,#,#,#,#,#,#,#,#,#,#,#,#,#</Item>
            <Item>#,#,#,#,#,#,#,#, , , , , , , , , ,#,#,#</Item>
        </Item>
        <!-- Level 7 -->
        <Item>
            <Item>#,#,#,#,#,#,#,#,#, , , , , , , , , , ,#</Item>
            <Item>#,#,#,#,#, , , ,#, , , , , , , , , , ,#</Item>
            <Item>#,#,#,#,#,B, , ,#, , , , , , , , , , ,#</Item>
            <Item>#,#,#,#,#, , ,B,#,#, , , , , , , , , ,#</Item>
            <Item>#,#,#, , ,B, ,B, ,#, , , , , , , , , ,#</Item>
            <Item>#,#,#, ,#, ,#,#, ,#, , , ,#,#,#,#,#,#,#</Item>
            <Item>#, , , ,#, ,#,#, ,#,#,#,#,#, , ,.,.,#,#</Item>
            <Item>#, ,B, , ,B, , , , , , , , , , ,.,.,#,#</Item>
            <Item>#,#,#,#,#, ,#,#,#, ,#,P,#,#, , ,.,.,#,#</Item>
            <Item>#,#,#,#,#, , , , , ,#,#,#,#,#,#,#,#,#,#</Item>
        </Item>
        <!-- Level 8 -->
        <Item>
            <Item>#,#,#,#, , , , , , ,#,#,#,#,#,#,#,#,#,#</Item>
            <Item>#, , , ,#,#,#,#,#,#,#,#,#,#,#,#,#,#,#,#</Item>
            <Item>#, , ,., , , , , ,#,#,#,#,#,#,#,#,#,#,#</Item>
            <Item>#, , ,#,B,B,B,B,B,#,#,#,#,#,#,#,#,#,#,#</Item>
            <Item>#, ,#,#,.,.,.,.,.,#,#,#,#,#,#,#,#,#,#,#</Item>
            <Item>#, , ,#, , ,B, , ,#,#,#,#,#,#,#,#,#,#,#</Item>
            <Item>#,#, ,#,#,#,#, ,#,#,#,#,#,#,#,#,#,#,#,#</Item>
            <Item>#, , , , , , , , ,#,#,#,#,#,#,#,#,#,#,#</Item>
            <Item>#, , , ,#,#, , ,P,#,#,#,#,#,#,#,#,#,#,#</Item>
            <Item>#,#,#,#,#,#,#,#,#,#,#,#,#,#,#,#,#,#,#,#</Item>
        </Item>
      <!-- Level 9 -->
        <Item>
            <Item>#,#,#,#,#,#,#,#,#,#,#,#,#,#,#,#,#,#,#,#</Item>
            <Item> , , ,#,#,#,#,#, , , ,#,#,#,#,#,#,#,#,#</Item>
            <Item>#,#,#,#, , , ,#, , , ,#,#,#,#,#,#,#,#,#</Item>
            <Item>#, , ,#,B, , ,#,#,#,#,#,#,#,#,#,#,#,#,#</Item>
            <Item>#, ,B,B, , , , , , ,#,#,#,#,#,#,#,#,#,#</Item>
            <Item>#,P, , ,#,B, ,B,#, ,#,#,#,#,#,#,#,#,#,#</Item>
            <Item>#,#,#, ,#, , , ,#, ,#,#,#,#,#,#,#,#,#,#</Item>
            <Item> ,#, , ,#,#,#,#,#, ,#,#,#,#,#,#,#,#,#,#</Item>
            <Item> ,#, , ,.,.,.,.,., ,#,#,#,#,#,#,#,#,#,#</Item>
            <Item> ,#,#,#,#,#,#,#,#,#,#,#,#,#,#,#,#,#,#,#</Item>
        </Item>

        <!-- Level 10 -->
        <Item>
            <Item>#,#,#,#,#, ,#,#,#,#, , , ,#,#,#,#,#,#,#</Item>
            <Item>#, , , ,#,#,#, , ,#,#,#,#,#,#,#,#,#,#,#</Item>
            <Item>#, , ,.,.,.,.,.,.,., , ,#,#,#,#,#,#,#,#</Item>
            <Item> ,#, ,#,#,B,#, , ,#, , ,#,#,#,#,#,#,#,#</Item>
            <Item> ,#, , , ,B,P,#, ,#, ,#,#,#,#,#,#,#,#,#</Item>
            <Item> ,#,#,B,B,B,B,B, ,#, ,#, ,#,#,#,#,#,#,#</Item>
            <Item> , ,#, ,#, , ,#,#,#, ,#, ,#,#,#,#,#,#,#</Item>
            <Item> , ,#, , , , , , , , ,#, ,#,#,#,#,#,#,#</Item>
            <Item> , ,#,#,#,#,#,#,#, , ,#, ,#,#,#,#,#,#,#</Item>
            <Item> , , , , , , , ,#,#,#,#, ,#,#,#,#,#,#,#</Item>
        </Item>
        <!-- Level 11 -->
        <Item>
            <Item>#,#,#,#,#,#,#, , ,#,#,#,#,#,#,#,#,#,#,#</Item>
            <Item>#, , , , , ,#, , ,#,#,#,#,#,#,#,#,#,#,#</Item>
            <Item>#,.,#,#,#, ,#,#,#,#,#,#,#,#,#,#,#,#,#,#</Item>
            <Item>#,.,#, ,B, ,B, ,#,#,#,#,#,#,#,#,#,#,#,#</Item>
            <Item>#,.,#, , ,P, , ,#,#,#,#,#,#,#,#,#,#,#,#</Item>
            <Item>#,.,#, ,B, ,B, ,#,#,#,#,#,#,#,#,#,#,#,#</Item>
            <Item>#,.,#,#,#,P, ,#,#,#,#,#,#,#,#,#,#,#,#,#</Item>
            <Item>#, , , , , , ,#, ,#,#,#,#,#,#,#,#,#,#,#</Item>
            <Item>#, , ,#,#,#,#,#, ,#,#,#,#,#,#,#,#,#,#,#</Item>
            <Item>#,#,#, , , , , , ,#,#,#,#,#,#,#,#,#,#,#</Item>
        </Item>
        <!-- Level 12 -->
        <Item>
            <Item> ,#,#,#,#,#,#,#, ,#,#,#,#,#,#,#,#,#,#,#</Item>
            <Item> ,#,P, , , , ,#, ,#,#,#,#,#,#,#,#,#,#,#</Item>
            <Item>#,#,B,#,#,B,B,#, ,#,#,#,#,#,#,#,#,#,#,#</Item>
            <Item>#, ,B, , , , ,#, ,#,#,#,#,#,#,#,#,#,#,#</Item>
            <Item>#, ,#,#,B,#, ,#,#,#,#,#,#,#,#,#,#,#,#,#</Item>
            <Item>#,.,.,.,.,.,.,.,#,#,#,#,#,#,#,#,#,#,#,#</Item>
            <Item>#,#,#, ,#,#, , ,#,#,#,#,#,#,#,#,#,#,#,#</Item>
            <Item>#, , , , , ,B,B,#,#,#,#,#,#,#,#,#,#,#,#</Item>
            <Item>#, , , ,#, , , ,#,#,#,#,#,#,#,#,#,#,#,#</Item>
            <Item>#,#,#,#,#,#,#,#,#,#,#,#,#,#,#,#,#,#,#,#</Item>
        </Item>

    </Asset>
</XnaContent>
